source_url,school_id,department_code,course_code,course_title,section,section_instructor,term,isbn,title,author,material_adoption_code,crawled_on,updated_on
https://www.ultimatemedical.edu/pdfs/Textbook_List.pdf,3012793,BC,|BC2025,Diagnostic Coding for MBC,|Online,,Spring 2026,9798892580885,CPC Textbook 2025 ed (AAPC),,Required,2026-03-25 00:00:00,2026-03-25 00:00:00
https://www.ultimatemedical.edu/pdfs/Textbook_List.pdf,3012793,BC,|BC2025,Diagnostic Coding for MBC,|Online,,Spring 2026,9781635277432,ICD 10 CM 2025 ed (AAPC),,Required,2026-03-25 00:00:00,2026-03-25 00:00:00
https://www.ultimatemedical.edu/pdfs/Textbook_List.pdf,3012793,BC,|BC2530,Procedural Coding I for MBC,|Online,,Spring 2026,9798892580885,CPC Textbook 2025 ed (AAPC),,Required,2026-03-25 00:00:00,2026-03-25 00:00:00
https://www.ultimatemedical.edu/pdfs/Textbook_List.pdf,3012793,BC,|BC2530,Procedural Coding I for MBC,|Online,,Spring 2026,9781635277449,HCPCS 2025 ed (AAPC),,Required,2026-03-25 00:00:00,2026-03-25 00:00:00
https://www.ultimatemedical.edu/pdfs/Textbook_List.pdf,3012793,BC,|BC2530,Procedural Coding I for MBC,|Online,,Spring 2026,9781635277432,ICD 10 CM 2025 ed (AAPC),,Required,2026-03-25 00:00:00,2026-03-25 00:00:00
https://www.ultimatemedical.edu/pdfs/Textbook_List.pdf,3012793,BC,|BC2535,Procedural Coding II for MBC,|Online,,Spring 2026,9798892580885,CPC Textbook 2025 ed (AAPC),,Required,2026-03-25 00:00:00,2026-03-25 00:00:00
https://www.ultimatemedical.edu/pdfs/Textbook_List.pdf,3012793,BC,|BC2535,Procedural Coding II for MBC,|Online,,Spring 2026,9781635277449,HCPCS 2025 ed (AAPC),,Required,2026-03-25 00:00:00,2026-03-25 00:00:00
https://www.ultimatemedical.edu/pdfs/Textbook_List.pdf,3012793,BC,|BC2535,Procedural Coding II for MBC,|Online,,Spring 2026,9781635277432,ICD 10 CM 2025 ed (AAPC),,Required,2026-03-25 00:00:00,2026-03-25 00:00:00
https://www.ultimatemedical.edu/pdfs/Textbook_List.pdf,3012793,BC,|BC3035,Billing and Coding Application with Simulation,|Online,,Spring 2026,9781635277449,HCPCS 2025 ed (AAPC),,Required,2026-03-25 00:00:00,2026-03-25 00:00:00
https://www.ultimatemedical.edu/pdfs/Textbook_List.pdf,3012793,BC,|BC3035,Billing and Coding Application with Simulation,|Online,,Spring 2026,9781635277432,ICD 10 CM 2025 ed (AAPC),,Required,2026-03-25 00:00:00,2026-03-25 00:00:00
https://www.ultimatemedical.edu/pdfs/Textbook_List.pdf,3012793,HT,|HT2600,Information Technology in the Healthcare Environment,|Online,,Spring 2026,9781584268840,"Introduction to Information Systems for Health Information Technology, 5e",,Required,2026-03-25 00:00:00,2026-03-25 00:00:00
https://www.ultimatemedical.edu/pdfs/Textbook_List.pdf,3012793,HT,|HT2700,"Health Information Leadership Roles, Theories, and Skills",|Online,,Spring 2026,9781584266815,Management for the Health Information Professional 2nd ed,,Required,2026-03-25 00:00:00,2026-03-25 00:00:00
https://www.ultimatemedical.edu/pdfs/Textbook_List.pdf,3012793,AC,|AC1000,Principles of Accounting I,|Online,,Spring 2026,9780357989388,College Accounting Ch 1-27 24th ed,,Required,2026-03-25 00:00:00,2026-03-25 00:00:00
https://www.ultimatemedical.edu/pdfs/Textbook_List.pdf,3012793,AC,|AC1020,Principles of Accounting II,|Online,,Spring 2026,9780357989388,College Accounting Ch 1-27 24th ed,,Required,2026-03-25 00:00:00,2026-03-25 00:00:00
https://www.ultimatemedical.edu/pdfs/Textbook_List.pdf,3012793,AC,|AC1030,Accounting Software Applications,|Online,,Spring 2026,9798214044781,Using QuickBooks Online for Accounting 2026 9th ed,,Required,2026-03-25 00:00:00,2026-03-25 00:00:00
https://www.ultimatemedical.edu/pdfs/Textbook_List.pdf,3012793,AC,|AC2060,Cost Accounting,|Online,,Spring 2026,9798214040820,Managerial Accounting 17th ed,,Required,2026-03-25 00:00:00,2026-03-25 00:00:00
https://www.ultimatemedical.edu/pdfs/Textbook_List.pdf,3012793,AC,|AC2140,Payroll Accounting,|Online,,Spring 2026,9780357988695,Payroll Accounting 2025 35th ed,,Required,2026-03-25 00:00:00,2026-03-25 00:00:00
https://www.ultimatemedical.edu/pdfs/Textbook_List.pdf,3012793,BC,|BC2050,Optimizing the Reimbursement Cycle,|Online,,Spring 2026,9781337626378,"MindTap MOSS 3.0, 2 terms Instant Access",,Required,2026-03-25 00:00:00,2026-03-25 00:00:00
https://www.ultimatemedical.edu/pdfs/Textbook_List.pdf,3012793,BC,|BC2050,Optimizing the Reimbursement Cycle,|Online,,Spring 2026,9798214482088,Understanding Health Insurance 21st ed 2026,,Required,2026-03-25 00:00:00,2026-03-25 00:00:00
https://www.ultimatemedical.edu/pdfs/Textbook_List.pdf,3012793,BC,|BC2530,Procedural Coding I for MBC,|Online,,Spring 2026,9781640163041,CPT Professional 2025 ed,,Required,2026-03-25 00:00:00,2026-03-25 00:00:00
https://www.ultimatemedical.edu/pdfs/Textbook_List.pdf,3012793,BC,|BC2535,Procedural Coding II for MBC,|Online,,Spring 2026,9781640163041,CPT Professional 2025 ed,,Required,2026-03-25 00:00:00,2026-03-25 00:00:00
https://www.ultimatemedical.edu/pdfs/Textbook_List.pdf,3012793,BC,|BC3035,Billing and Coding Application with Simulation,|Online,,Spring 2026,9781640163041,CPT Professional 2025 ed,,Required,2026-03-25 00:00:00,2026-03-25 00:00:00
https://www.ultimatemedical.edu/pdfs/Textbook_List.pdf,3012793,BC,|BC3035,Billing and Coding Application with Simulation,|Online,,Spring 2026,9798214113555,MindTap Professional Review Guide for the CPC Examination,,Required,2026-03-25 00:00:00,2026-03-25 00:00:00
https://www.ultimatemedical.edu/pdfs/Textbook_List.pdf,3012793,CI,|CI1000,Introduction to Computers,|Online,,Spring 2026,9780357675366,"Discovering Computers Digital Technology, Data, & Devices 17th ed",,Required,2026-03-25 00:00:00,2026-03-25 00:00:00
https://www.ultimatemedical.edu/pdfs/Textbook_List.pdf,3012793,CI,|CI1000,Introduction to Computers,|Online,,Spring 2026,9780357674925,"Illustrated Series Collection, Microsoft 365 & Office 2021 Intro",,Required,2026-03-25 00:00:00,2026-03-25 00:00:00
https://www.ultimatemedical.edu/pdfs/Textbook_List.pdf,3012793,CI,|CI1154,Introduction to Healthcare Computer Information Systems,|Online,,Spring 2026,9780357026243,The Illustrated Collection MS Office 365 & Office 2019: Intro 1st ed,,Required,2026-03-25 00:00:00,2026-03-25 00:00:00
https://www.ultimatemedical.edu/pdfs/Textbook_List.pdf,3012793,CI,|CI1175,Introduction to Computer Office Productivity Applications,|Online,,Spring 2026,9780357026243,The Illustrated Collection MS Office 365 & Office 2019: Intro 1st ed,,Required,2026-03-25 00:00:00,2026-03-25 00:00:00
https://www.ultimatemedical.edu/pdfs/Textbook_List.pdf,3012793,CI,|CI2000,Computer Fundamentals,|Online,,Spring 2026,9780357026243,The Illustrated Collection MS Office 365 & Office 2019: Intro 1st ed,,Required,2026-03-25 00:00:00,2026-03-25 00:00:00
https://www.ultimatemedical.edu/pdfs/Textbook_List.pdf,3012793,EN,|EN1150,English Composition,|Online,,Spring 2026,9780357505847,"Guide to Thinking, Writing & Researching 7th ed",,Required,2026-03-25 00:00:00,2026-03-25 00:00:00
https://www.ultimatemedical.edu/pdfs/Textbook_List.pdf,3012793,EN,|EN2100,English Composition II,|Online,,Spring 2026,9780357505847,"Guide to Thinking, Writing & Researching 7th ed",,Required,2026-03-25 00:00:00,2026-03-25 00:00:00
https://www.ultimatemedical.edu/pdfs/Textbook_List.pdf,3012793,EN,|EN2150,Interpersonal Professional Communications,|Online,,Spring 2026,9780357714973,Essentials of Business Communication 12th ed,,Required,2026-03-25 00:00:00,2026-03-25 00:00:00
https://www.ultimatemedical.edu/pdfs/Textbook_List.pdf,3012793,HM,|HM1015,Medical Terminology & the Healthcare Claim Cycle I,|Online,,Spring 2026,9798214482088,Understanding Health Insurance 21st ed 2026,,Required,2026-03-25 00:00:00,2026-03-25 00:00:00
https://www.ultimatemedical.edu/pdfs/Textbook_List.pdf,3012793,HM,|HM1015,Medical Terminology & the Healthcare Claim Cycle I,|Online,,Spring 2026,9780357772102,Medical Terminology for Health Professions 9th ed,,Required,2026-03-25 00:00:00,2026-03-25 00:00:00
https://www.ultimatemedical.edu/pdfs/Textbook_List.pdf,3012793,HM,|HM1020,Medical Terminology & the Healthcare Claim Cycle II,|Online,,Spring 2026,9798214482088,Understanding Health Insurance 21st ed 2026,,Required,2026-03-25 00:00:00,2026-03-25 00:00:00
https://www.ultimatemedical.edu/pdfs/Textbook_List.pdf,3012793,HM,|HM1020,Medical Terminology & the Healthcare Claim Cycle II,|Online,,Spring 2026,9780357772102,Medical Terminology for Health Professions 9th ed,,Required,2026-03-25 00:00:00,2026-03-25 00:00:00
https://www.ultimatemedical.edu/pdfs/Textbook_List.pdf,3012793,HM,|HM1025,Medical Practice Management Systems,|Online,,Spring 2026,9781337103275,Keyboarding & Word Processing Complete Course Lessons 1-110 20th Ed,,Required,2026-03-25 00:00:00,2026-03-25 00:00:00
https://www.ultimatemedical.edu/pdfs/Textbook_List.pdf,3012793,HM,|HM1025,Medical Practice Management Systems,|Online,,Spring 2026,9781337626378,"MindTap MOSS 3.0, 2 terms Instant Access",,Required,2026-03-25 00:00:00,2026-03-25 00:00:00
https://www.ultimatemedical.edu/pdfs/Textbook_List.pdf,3012793,HM,|HM1030,"Accounting, Payroll, Banking & Accounting Systems",|Online,,Spring 2026,9781337794756,College Accounting 23rd ed,,Required,2026-03-25 00:00:00,2026-03-25 00:00:00
https://www.ultimatemedical.edu/pdfs/Textbook_List.pdf,3012793,HM,|HM2010,Business Office Operations for the Manager,|Online,,Spring 2026,9780357622049,Intro to Health Care Finance & Accounting 2nd ed,,Required,2026-03-25 00:00:00,2026-03-25 00:00:00
https://www.ultimatemedical.edu/pdfs/Textbook_List.pdf,3012793,HM,|HM2015,"Healthcare Law, Compliance, Ethics & Medical Record Management",|Online,,Spring 2026,9780357691557,Legal & Ethical Aspects of Health Information Management 4th ed,,Required,2026-03-25 00:00:00,2026-03-25 00:00:00
https://www.ultimatemedical.edu/pdfs/Textbook_List.pdf,3012793,HM,|HM2020,Human Resource Management,|Online,,Spring 2026,9780357512449,Healthcare Human Resource Management 4th ed,,Required,2026-03-25 00:00:00,2026-03-25 00:00:00
https://www.ultimatemedical.edu/pdfs/Textbook_List.pdf,3012793,HM,|HM2028,Healthcare Business Operations,|Online,,Spring 2026,9780357622049,Intro to Health Care Finance & Accounting 2nd ed,,Required,2026-03-25 00:00:00,2026-03-25 00:00:00
https://www.ultimatemedical.edu/pdfs/Textbook_List.pdf,3012793,HM,|HM2030,Practice Structure and Enhancement,|Online,,Spring 2026,9780357625514,Revenue Cycle For Healthcare 1st ed,,Required,2026-03-25 00:00:00,2026-03-25 00:00:00
https://www.ultimatemedical.edu/pdfs/Textbook_List.pdf,3012793,HS,|HS1000,Introduction to Health and Human Services,|Online,,Spring 2026,9781337567176,Introduction to Human Services 9th ed,,Required,2026-03-25 00:00:00,2026-03-25 00:00:00
https://www.ultimatemedical.edu/pdfs/Textbook_List.pdf,3012793,HS,|HS1200,Introduction to Counseling,|Online,,Spring 2026,9781305271500,Essential Interviewing 9th ed,,Required,2026-03-25 00:00:00,2026-03-25 00:00:00
https://www.ultimatemedical.edu/pdfs/Textbook_List.pdf,3012793,HS,|HS1300,Public and Community Health,|Online,,Spring 2026,9781285182636,Principles of Public Health Practice 4th ed,,Required,2026-03-25 00:00:00,2026-03-25 00:00:00
https://www.ultimatemedical.edu/pdfs/Textbook_List.pdf,3012793,HS,|HS2100,Family Dynamics,|Online,,Spring 2026,9781305092969,Family Therapy 9th ed,,Required,2026-03-25 00:00:00,2026-03-25 00:00:00
https://www.ultimatemedical.edu/pdfs/Textbook_List.pdf,3012793,HS,|HS2200,Social Welfare,|Online,,Spring 2026,9781305101906,Social Work and Social Welfare 8th ed,,Required,2026-03-25 00:00:00,2026-03-25 00:00:00
https://www.ultimatemedical.edu/pdfs/Textbook_List.pdf,3012793,HS,|HS2305,Legal and Ethical Issues in Human Services,|Online,,Spring 2026,9780357622599,Issues and Ethics in the Helping Professions 11th ed,,Required,2026-03-25 00:00:00,2026-03-25 00:00:00
https://www.ultimatemedical.edu/pdfs/Textbook_List.pdf,3012793,HS,|HS2500,Health and Human Services Capstone,|Online,,Spring 2026,9781305865716,Problem Management & Opportunity Develop Approach to Helping 11th ed,,Required,2026-03-25 00:00:00,2026-03-25 00:00:00
https://www.ultimatemedical.edu/pdfs/Textbook_List.pdf,3012793,HT,|HT1000,Introduction to U.S. Healthcare Delivery,|Online,,Spring 2026,9781337553674,Health Information Management: Principles and Practices 4th ed.,,Required,2026-03-25 00:00:00,2026-03-25 00:00:00
https://www.ultimatemedical.edu/pdfs/Textbook_List.pdf,3012793,HT,|HT1000,Introduction to U.S. Healthcare Delivery,|Online,,Spring 2026,9781418052980,The U.S Health System: Origins & Functions 6th ed,,Required,2026-03-25 00:00:00,2026-03-25 00:00:00
https://www.ultimatemedical.edu/pdfs/Textbook_List.pdf,3012793,HT,|HT1300,Introduction to Health Information and the Healthcare Record,|Online,,Spring 2026,9781337553674,Essentials of Health Information Management 4th ed,,Required,2026-03-25 00:00:00,2026-03-25 00:00:00
https://www.ultimatemedical.edu/pdfs/Textbook_List.pdf,3012793,HT,|HT1350,"Healthcare Law, Policies, and Ethics",|Online,,Spring 2026,9780357361542,Legal & Ethical Aspects of Health Information Management 5th ed,,Required,2026-03-25 00:00:00,2026-03-25 00:00:00
https://www.ultimatemedical.edu/pdfs/Textbook_List.pdf,3012793,HT,|HT1700,International Classification of Diseases (ICD) Coding I,|Online,,Spring 2026,9780357932339,Understanding ICD-10-CM and ICD-10-PCS: A Worktext 9th ed 2024,,Required,2026-03-25 00:00:00,2026-03-25 00:00:00
https://www.ultimatemedical.edu/pdfs/Textbook_List.pdf,3012793,HT,|HT1700,International Classification of Diseases (ICD) Coding I,|Online,,Spring 2026,9781622549429,ICD 10 CM Professionals for Hospitals 2025 ed,,Required,2026-03-25 00:00:00,2026-03-25 00:00:00
https://www.ultimatemedical.edu/pdfs/Textbook_List.pdf,3012793,HT,|HT1725,International Classification of Diseases (ICD) Coding II,|Online,,Spring 2026,9798214113197,Understanding ICD-10-CM and ICD-10-PCS: A Worktext 10th ed 2025,,Required,2026-03-25 00:00:00,2026-03-25 00:00:00
https://www.ultimatemedical.edu/pdfs/Textbook_List.pdf,3012793,HT,|HT1725,International Classification of Diseases (ICD) Coding II,|Online,,Spring 2026,9781622549429,ICD 10 CM Professionals for Hospitals 2025 ed,,Required,2026-03-25 00:00:00,2026-03-25 00:00:00
https://www.ultimatemedical.edu/pdfs/Textbook_List.pdf,3012793,HT,|HT1725,International Classification of Diseases (ICD) Coding II,|Online,,Spring 2026,9781622549528,ICD 10 PCS Professional 2025 ed,,Required,2026-03-25 00:00:00,2026-03-25 00:00:00
https://www.ultimatemedical.edu/pdfs/Textbook_List.pdf,3012793,HT,|HT1775,Current Procedural Terminology (CPT) Coding,|Online,,Spring 2026,9781640163041,CPT Professional 2025 ed,,Required,2026-03-25 00:00:00,2026-03-25 00:00:00
https://www.ultimatemedical.edu/pdfs/Textbook_List.pdf,3012793,HT,|HT1775,Current Procedural Terminology (CPT) Coding,|Online,,Spring 2026,9798214113296,Understanding CPT and HCPCS Coding Systems 12th ed 2025,,Required,2026-03-25 00:00:00,2026-03-25 00:00:00
https://www.ultimatemedical.edu/pdfs/Textbook_List.pdf,3012793,HT,|HT1775,Current Procedural Terminology (CPT) Coding,|Online,,Spring 2026,9781622549634,HCPCS Professional 2025 ed,,Required,2026-03-25 00:00:00,2026-03-25 00:00:00
https://www.ultimatemedical.edu/pdfs/Textbook_List.pdf,3012793,HT,|HT2050,Healthcare Reimbursement & the Revenue Cycle,|Online,,Spring 2026,9780357933114,"MindTap MOSS 4.0, 4 terms Instant Access 1st ed",,Required,2026-03-25 00:00:00,2026-03-25 00:00:00
https://www.ultimatemedical.edu/pdfs/Textbook_List.pdf,3012793,HT,|HT2050,Healthcare Reimbursement & the Revenue Cycle,|Online,,Spring 2026,9798214482088,Understanding Health Insurance 21st ed 2026,,Required,2026-03-25 00:00:00,2026-03-25 00:00:00
https://www.ultimatemedical.edu/pdfs/Textbook_List.pdf,3012793,HT,|HT2200,Statistics and Data Sets in Healthcare,|Online,,Spring 2026,9780357699997,Basic Allied Health Statistics and Analysis 4th ed,,Required,2026-03-25 00:00:00,2026-03-25 00:00:00
https://www.ultimatemedical.edu/pdfs/Textbook_List.pdf,3012793,HT,|HT2200,Statistics and Data Sets in Healthcare,|Online,,Spring 2026,9781305509788,Math for Health Care Professionals 2nd ed,,Required,2026-03-25 00:00:00,2026-03-25 00:00:00
https://www.ultimatemedical.edu/pdfs/Textbook_List.pdf,3012793,HT,|HT2800,Developing PPE Skills & Certification Preparation,|Online,,Spring 2026,9780357932711,Professional Review Guide for the RHIA/RHIT Examination 2024 ed,,Required,2026-03-25 00:00:00,2026-03-25 00:00:00
https://www.ultimatemedical.edu/pdfs/Textbook_List.pdf,3012793,HT,|HT3100,Health Information Professional Practice Experience (PPE),|Online,,Spring 2026,9780357369128,Professional Review Guide for the RHIA/RHIT Examination 2020 ed,,Required,2026-03-25 00:00:00,2026-03-25 00:00:00
https://www.ultimatemedical.edu/pdfs/Textbook_List.pdf,3012793,HU,|HU2000,Critical Thinking and Problem Solving,|Online,,Spring 2026,9781337558501,Thinking Critically 12th ed,,Required,2026-03-25 00:00:00,2026-03-25 00:00:00
https://www.ultimatemedical.edu/pdfs/Textbook_List.pdf,3012793,MA,|MA1015,College Math,|Online,,Spring 2026,9781133365440,Basic College Mathematics 10th ed,,Required,2026-03-25 00:00:00,2026-03-25 00:00:00
https://www.ultimatemedical.edu/pdfs/Textbook_List.pdf,3012793,ME,|ME1000,Introduction to Healthcare Communication,|Online,,Spring 2026,9780357691380,Therapeutic Communication for Health Professionals 4th ed,,Required,2026-03-25 00:00:00,2026-03-25 00:00:00
https://www.ultimatemedical.edu/pdfs/Textbook_List.pdf,3012793,ME,|ME1105,ME1105 - Medical Assistant Foundations,|Online,,Spring 2026,9798214113586,Medical Assisting: Administrative & Clinical Competencies 10th ed,,Required,2026-03-25 00:00:00,2026-03-25 00:00:00
https://www.ultimatemedical.edu/pdfs/Textbook_List.pdf,3012793,ME,|ME1120,Introduction to Medical Administrative Assisting,|Online,,Spring 2026,9780357765272,Administrative Medical Assisting 9th ed,,Required,2026-03-25 00:00:00,2026-03-25 00:00:00
https://www.ultimatemedical.edu/pdfs/Textbook_List.pdf,3012793,ME,|ME1125,Introduction to Medical Billing,|Online,,Spring 2026,9798214113586,Medical Assisting: Administrative & Clinical Competencies 10th ed,,Required,2026-03-25 00:00:00,2026-03-25 00:00:00
https://www.ultimatemedical.edu/pdfs/Textbook_List.pdf,3012793,ME,|ME1160,Medical Terminology,|Online,,Spring 2026,9780357772102,Medical Terminology for Health Professions 9th ed,,Required,2026-03-25 00:00:00,2026-03-25 00:00:00
https://www.ultimatemedical.edu/pdfs/Textbook_List.pdf,3012793,ME,|ME1200,ME1200 - Medical Terminology,|Online,,Spring 2026,9780357772102,Medical Terminology for Health Professions 9th ed,,Required,2026-03-25 00:00:00,2026-03-25 00:00:00
https://www.ultimatemedical.edu/pdfs/Textbook_List.pdf,3012793,ME,|ME1410,"Medical Law, Ethics, and Records Management",|Online,,Spring 2026,9781305946064,HIPAA for Health Care Professionals 2nd ed,,Required,2026-03-25 00:00:00,2026-03-25 00:00:00
https://www.ultimatemedical.edu/pdfs/Textbook_List.pdf,3012793,ME,|ME1410,"Medical Law, Ethics, and Records Management",|Online,,Spring 2026,9781337626378,"MindTap MOSS 3.0, 2 terms Instant Access",,Required,2026-03-25 00:00:00,2026-03-25 00:00:00
https://www.ultimatemedical.edu/pdfs/Textbook_List.pdf,3012793,ME,|ME1575,Pathophysiology and Pharmacology,|Online,,Spring 2026,9798214116068,Essentials of Pharmacology for Health Professions 10th ed,,Required,2026-03-25 00:00:00,2026-03-25 00:00:00
https://www.ultimatemedical.edu/pdfs/Textbook_List.pdf,3012793,ME,|ME1575,Pathophysiology and Pharmacology,|Online,,Spring 2026,9780357618158,Human Diseases 6th ed,,Required,2026-03-25 00:00:00,2026-03-25 00:00:00
https://www.ultimatemedical.edu/pdfs/Textbook_List.pdf,3012793,ME,|ME1750,Medical Transcription,|Online,,Spring 2026,9781305583924,Healthcare Documentation & Medical Transcription 8th ed,,Required,2026-03-25 00:00:00,2026-03-25 00:00:00
https://www.ultimatemedical.edu/pdfs/Textbook_List.pdf,3012793,ME,|ME2100,ME2100 - Clinical Medical Assisting Procedures,|Online,,Spring 2026,9798214113586,Medical Assisting: Administrative & Clinical Competencies 10th ed,,Required,2026-03-25 00:00:00,2026-03-25 00:00:00
https://www.ultimatemedical.edu/pdfs/Textbook_List.pdf,3012793,ME,|ME2530,Diagnostic Coding for MAA/MOBS,|Online,,Spring 2026,9798214113197,Understanding ICD-10-CM and ICD-10-PCS: A Worktext 10th ed 2025,,Required,2026-03-25 00:00:00,2026-03-25 00:00:00
https://www.ultimatemedical.edu/pdfs/Textbook_List.pdf,3012793,ME,|ME2530,Diagnostic Coding for MAA/MOBS,|Online,,Spring 2026,9781622549429,ICD 10 CM Professionals for Hospitals 2025 ed,,Required,2026-03-25 00:00:00,2026-03-25 00:00:00
https://www.ultimatemedical.edu/pdfs/Textbook_List.pdf,3012793,ME,|ME2535,Procedural Coding for MAA/MOBS,|Online,,Spring 2026,9781640163041,CPT Professional 2025 ed,,Required,2026-03-25 00:00:00,2026-03-25 00:00:00
https://www.ultimatemedical.edu/pdfs/Textbook_List.pdf,3012793,ME,|ME2535,Procedural Coding for MAA/MOBS,|Online,,Spring 2026,9798214113296,Understanding CPT and HCPCS Coding Systems 12th ed 2025,,Required,2026-03-25 00:00:00,2026-03-25 00:00:00
https://www.ultimatemedical.edu/pdfs/Textbook_List.pdf,3012793,ME,|ME2535,Procedural Coding for MAA/MOBS,|Online,,Spring 2026,9781622549634,HCPCS Professional 2025 ed,,Required,2026-03-25 00:00:00,2026-03-25 00:00:00
https://www.ultimatemedical.edu/pdfs/Textbook_List.pdf,3012793,ME,|ME2540,Healthcare Reimbursement and Claim Cycle,|Online,,Spring 2026,9781337626378,"MindTap MOSS 3.0, 2 terms Instant Access",,Required,2026-03-25 00:00:00,2026-03-25 00:00:00
https://www.ultimatemedical.edu/pdfs/Textbook_List.pdf,3012793,ME,|ME2540,Healthcare Reimbursement and Claim Cycle,|Online,,Spring 2026,9798214482088,Understanding Health Insurance 21st ed 2026,,Required,2026-03-25 00:00:00,2026-03-25 00:00:00
https://www.ultimatemedical.edu/pdfs/Textbook_List.pdf,3012793,ME,|ME2550,"Healthcare Settings, Claim Cycle, and Claims Processing",|Online,,Spring 2026,9798214482088,Understanding Health Insurance 21st ed 2026,,Required,2026-03-25 00:00:00,2026-03-25 00:00:00
https://www.ultimatemedical.edu/pdfs/Textbook_List.pdf,3012793,MG,|MG2150,Introduction to Leadership & Management,|Online,,Spring 2026,9780357517345,Fundamentals of Management 10th ed,,Required,2026-03-25 00:00:00,2026-03-25 00:00:00
https://www.ultimatemedical.edu/pdfs/Textbook_List.pdf,3012793,PS,|PS1000,Psychology,|Online,,Spring 2026,9780357363232,Discovering Psychology: The Science of Mind 4th ed,,Required,2026-03-25 00:00:00,2026-03-25 00:00:00
https://www.ultimatemedical.edu/pdfs/Textbook_List.pdf,3012793,PS,|PS2100,Working with People,|Online,,Spring 2026,9781305576162,Effective Human Relations 13th ed,,Required,2026-03-25 00:00:00,2026-03-25 00:00:00
https://www.ultimatemedical.edu/pdfs/Textbook_List.pdf,3012793,PS,|PS2150,Patient Relations,|Online,,Spring 2026,9780357618608,Understanding Human Behavior 10th ed 2024,,Required,2026-03-25 00:00:00,2026-03-25 00:00:00
https://www.ultimatemedical.edu/pdfs/Textbook_List.pdf,3012793,RX,|RX1010,Pharmacy Technician Fundamentals & Computer Applications,|Online,,Spring 2026,9780357765975,Pharmaceutical Calculations for Pharmacy Technicians 3rd ed,,Required,2026-03-25 00:00:00,2026-03-25 00:00:00
https://www.ultimatemedical.edu/pdfs/Textbook_List.pdf,3012793,RX,|RX1010,Pharmacy Technician Fundamentals & Computer Applications,|Online,,Spring 2026,9798214113739,Pharmacy Technician 5th ed,,Required,2026-03-25 00:00:00,2026-03-25 00:00:00
https://www.ultimatemedical.edu/pdfs/Textbook_List.pdf,3012793,RX,|RX1020,Pharmacology and Sterile Products & HIV/AIDS,|Online,,Spring 2026,9798214116068,Essentials of Pharmacology for Health Professions 10th ed,,Required,2026-03-25 00:00:00,2026-03-25 00:00:00
https://www.ultimatemedical.edu/pdfs/Textbook_List.pdf,3012793,RX,|RX1020,Pharmacology and Sterile Products & HIV/AIDS,|Online,,Spring 2026,9780357765975,Pharmaceutical Calculations for Pharmacy Technicians 3rd ed,,Required,2026-03-25 00:00:00,2026-03-25 00:00:00
https://www.ultimatemedical.edu/pdfs/Textbook_List.pdf,3012793,RX,|RX1020,Pharmacology and Sterile Products & HIV/AIDS,|Online,,Spring 2026,9798214113739,Pharmacy Technician 5th ed,,Required,2026-03-25 00:00:00,2026-03-25 00:00:00
https://www.ultimatemedical.edu/pdfs/Textbook_List.pdf,3012793,RX,|RX1030,Anatomy & Physiology and Pathophysiology I,|Online,,Spring 2026,9780357457542,Body Structures and Functions 14th ed,,Required,2026-03-25 00:00:00,2026-03-25 00:00:00
https://www.ultimatemedical.edu/pdfs/Textbook_List.pdf,3012793,RX,|RX1030,Anatomy & Physiology and Pathophysiology I,|Online,,Spring 2026,9781285429502,Dosage Calculations: A Ratio-Proportion Approach 4th ed,,Required,2026-03-25 00:00:00,2026-03-25 00:00:00
https://www.ultimatemedical.edu/pdfs/Textbook_List.pdf,3012793,RX,|RX1030,Anatomy & Physiology and Pathophysiology I,|Online,,Spring 2026,9798214116068,Essentials of Pharmacology for Health Professions 10th ed,,Required,2026-03-25 00:00:00,2026-03-25 00:00:00
https://www.ultimatemedical.edu/pdfs/Textbook_List.pdf,3012793,RX,|RX2010,Pharmaceutical Calculations and Pathophysiology II,|Online,,Spring 2026,9780357457542,Body Structures and Functions 14th ed,,Required,2026-03-25 00:00:00,2026-03-25 00:00:00
https://www.ultimatemedical.edu/pdfs/Textbook_List.pdf,3012793,RX,|RX2010,Pharmaceutical Calculations and Pathophysiology II,|Online,,Spring 2026,9780357765975,Pharmaceutical Calculations for Pharmacy Technicians 3rd ed,,Required,2026-03-25 00:00:00,2026-03-25 00:00:00
https://www.ultimatemedical.edu/pdfs/Textbook_List.pdf,3012793,RX,|RX2010,Pharmaceutical Calculations and Pathophysiology II,|Online,,Spring 2026,9798214113739,Pharmacy Technician 5th ed,,Required,2026-03-25 00:00:00,2026-03-25 00:00:00
